[
  {
    "id": "c1c38ff8-82bd-4a5b-8fb5-001f89e1eb74",
    "branchNumber": 2,
    "supplierNumber": 0,
    "shopNumber": 0,
    "categoryNumber": 5303,
    "active": false,
    "date": "2004-03-31T00:00:00",
    "stocktakingDate": "2004-04-03T00:00:00",
    "type": 0,
    "lastChange": "2019-10-22T22:51:26.9023331",
    "isDeleted": false
  },
  {
    "id": "533dbe86-ee3a-4007-961d-00451adeecad",
    "branchNumber": 2,
    "supplierNumber": 0,
    "shopNumber": 0,
    "categoryNumber": 6682,
    "active": false,
    "date": "2004-03-31T00:00:00",
    "stocktakingDate": "2004-04-03T00:00:00",
    "type": 0,
    "lastChange": "2019-10-22T22:51:26.9023331",
    "isDeleted": false
  },
  {
    "id": "73c90315-f050-4cc9-93e8-012deab0510e",
    "branchNumber": 2,
    "supplierNumber": 0,
    "shopNumber": 0,
    "categoryNumber": 112115,
    "active": false,
    "date": "2004-03-31T00:00:00",
    "stocktakingDate": "2004-04-03T00:00:00",
    "type": 0,
    "lastChange": "2019-10-22T22:51:26.9023331",
    "isDeleted": false
  },
  {
    "id": "54835746-c6a7-4d66-979f-0156ea027eba",
    "branchNumber": 2,
    "supplierNumber": 0,
    "shopNumber": 0,
    "categoryNumber": 3001,
    "active": false,
    "date": "2004-03-31T00:00:00",
    "stocktakingDate": "2004-04-03T00:00:00",
    "type": 0,
    "lastChange": "2019-10-22T22:51:26.9023331",
    "isDeleted": false
  },
  {
    "id": "77b2a605-fefa-47c0-a581-015b2dbfbd1d",
    "branchNumber": 2,
    "supplierNumber": 0,
    "shopNumber": 0,
    "categoryNumber": 6850,
    "active": false,
    "date": "2004-03-31T00:00:00",
    "stocktakingDate": "2004-04-03T00:00:00",
    "type": 0,
    "lastChange": "2019-10-22T22:51:26.9023331",
    "isDeleted": false
  },
  {
    "id": "ae0484b8-d3ff-42d7-a7f0-016d66a34f04",
    "branchNumber": 1,
    "supplierNumber": 0,
    "shopNumber": 0,
    "categoryNumber": 9208,
    "active": false,
    "date": "2004-03-31T00:00:00",
    "stocktakingDate": "2004-04-13T00:00:00",
    "type": 0,
    "lastChange": "2019-10-22T22:51:26.9023331",
    "isDeleted": false
  },
  {
    "id": "633e9b5b-8c1b-4405-9b50-01a8f988ffbb",
    "branchNumber": 2,
    "supplierNumber": 0,
    "shopNumber": 0,
    "categoryNumber": 5200,
    "active": false,
    "date": "2004-03-31T00:00:00",
    "stocktakingDate": "2004-04-03T00:00:00",
    "type": 0,
    "lastChange": "2019-10-22T22:51:26.9023331",
    "isDeleted": false
  },
  {
    "id": "a7ce13d2-2a91-4b50-bb14-01ab59e90d8d",
    "branchNumber": 2,
    "supplierNumber": 0,
    "shopNumber": 0,
    "categoryNumber": 1399,
    "active": false,
    "date": "2004-03-31T00:00:00",
    "stocktakingDate": "2004-04-03T00:00:00",
    "type": 0,
    "lastChange": "2019-10-22T22:51:26.9023331",
    "isDeleted": false
  },
  {
    "id": "9c49b8a2-dbbe-4191-9651-01c26e2f2fec",
    "branchNumber": 1,
    "supplierNumber": 0,
    "shopNumber": 0,
    "categoryNumber": 5061,
    "active": false,
    "date": "2004-03-31T00:00:00",
    "stocktakingDate": "2004-04-13T00:00:00",
    "type": 0,
    "lastChange": "2019-10-22T22:51:26.9023331",
    "isDeleted": false
  },
  {
    "id": "03228f2b-55f9-42a9-9c4d-025c84312773",
    "branchNumber": 2,
    "supplierNumber": 0,
    "shopNumber": 0,
    "categoryNumber": 9608,
    "active": false,
    "date": "2004-03-31T00:00:00",
    "stocktakingDate": "2004-04-03T00:00:00",
    "type": 0,
    "lastChange": "2019-10-22T22:51:26.9023331",
    "isDeleted": false
  },
  {
    "id": "760e97c4-613a-4dcf-abcf-0273fbf840f9",
    "branchNumber": 2,
    "supplierNumber": 0,
    "shopNumber": 0,
    "categoryNumber": 1480,
    "active": false,
    "date": "2004-03-31T00:00:00",
    "stocktakingDate": "2004-04-03T00:00:00",
    "type": 0,
    "lastChange": "2019-10-22T22:51:26.9023331",
    "isDeleted": false
  },
  {
    "id": "8c7b7d3f-f353-44bb-a575-027f69ce6e16",
    "branchNumber": 1,
    "supplierNumber": 0,
    "shopNumber": 0,
    "categoryNumber": 9632,
    "active": false,
    "date": "2004-03-31T00:00:00",
    "stocktakingDate": "2004-04-13T00:00:00",
    "type": 0,
    "lastChange": "2019-10-22T22:51:26.9023331",
    "isDeleted": false
  },
  {
    "id": "a6d1a4bc-93ed-41dc-a06f-02e9ab98c739",
    "branchNumber": 1,
    "supplierNumber": 0,
    "shopNumber": 0,
    "categoryNumber": 3700,
    "active": false,
    "date": "2004-03-31T00:00:00",
    "stocktakingDate": "2004-04-13T00:00:00",
    "type": 0,
    "lastChange": "2019-10-22T22:51:26.9023331",
    "isDeleted": false
  },
  {
    "id": "d04266f9-cb3f-4b17-b1b5-0365b6f2b76a",
    "branchNumber": 2,
    "supplierNumber": 0,
    "shopNumber": 0,
    "categoryNumber": 9500,
    "active": false,
    "date": "2004-03-31T00:00:00",
    "stocktakingDate": "2004-04-03T00:00:00",
    "type": 0,
    "lastChange": "2019-10-22T22:51:26.9023331",
    "isDeleted": false
  },
  {
    "id": "44f13dc4-53cc-414f-bf9b-038be4e6f1ea",
    "branchNumber": 2,
    "supplierNumber": 0,
    "shopNumber": 0,
    "categoryNumber": 5314,
    "active": false,
    "date": "2004-03-31T00:00:00",
    "stocktakingDate": "2004-04-03T00:00:00",
    "type": 0,
    "lastChange": "2019-10-22T22:51:26.9023331",
    "isDeleted": false
  },
  {
    "id": "7dcf06cd-f50e-4fdc-be94-03b1731f8e6f",
    "branchNumber": 1,
    "supplierNumber": 0,
    "shopNumber": 0,
    "categoryNumber": 1297,
    "active": false,
    "date": "2004-03-31T00:00:00",
    "stocktakingDate": "2004-04-13T00:00:00",
    "type": 0,
    "lastChange": "2019-10-22T22:51:26.9023331",
    "isDeleted": false
  },
  {
    "id": "0ff7bbfe-311d-4795-bc5f-03ccc7f30638",
    "branchNumber": 2,
    "supplierNumber": 0,
    "shopNumber": 0,
    "categoryNumber": 1950,
    "active": false,
    "date": "2004-03-31T00:00:00",
    "stocktakingDate": "2004-04-03T00:00:00",
    "type": 0,
    "lastChange": "2019-10-22T22:51:26.9023331",
    "isDeleted": false
  },
  {
    "id": "62732256-6248-4c8f-850f-03e1db05a9b1",
    "branchNumber": 1,
    "supplierNumber": 0,
    "shopNumber": 0,
    "categoryNumber": 6882,
    "active": false,
    "date": "2004-03-31T00:00:00",
    "stocktakingDate": "2004-04-13T00:00:00",
    "type": 0,
    "lastChange": "2019-10-22T22:51:26.9023331",
    "isDeleted": false
  },
  {
    "id": "8bc1d4b6-8e16-4212-817a-03f85c10f0c2",
    "branchNumber": 1,
    "supplierNumber": 0,
    "shopNumber": 0,
    "categoryNumber": 7120,
    "active": false,
    "date": "2004-03-31T00:00:00",
    "stocktakingDate": "2004-04-13T00:00:00",
    "type": 0,
    "lastChange": "2019-10-22T22:51:26.9023331",
    "isDeleted": false
  },
  {
    "id": "eaa5f40e-fb41-428d-9bd9-04090f43f3e1",
    "branchNumber": 1,
    "supplierNumber": 0,
    "shopNumber": 0,
    "categoryNumber": 5299,
    "active": false,
    "date": "2004-03-31T00:00:00",
    "stocktakingDate": "2004-04-13T00:00:00",
    "type": 0,
    "lastChange": "2019-10-22T22:51:26.9023331",
    "isDeleted": false
  },
  {
    "id": "e91e99da-faad-4ef7-8898-0446ce930afe",
    "branchNumber": 1,
    "supplierNumber": 0,
    "shopNumber": 0,
    "categoryNumber": 1301,
    "active": false,
    "date": "2004-03-31T00:00:00",
    "stocktakingDate": "2004-04-13T00:00:00",
    "type": 0,
    "lastChange": "2019-10-22T22:51:26.9023331",
    "isDeleted": false
  },
  {
    "id": "d5c07582-b9d4-4170-9956-044feb645616",
    "branchNumber": 2,
    "supplierNumber": 0,
    "shopNumber": 0,
    "categoryNumber": 7782,
    "active": false,
    "date": "2004-03-31T00:00:00",
    "stocktakingDate": "2004-04-03T00:00:00",
    "type": 0,
    "lastChange": "2019-10-22T22:51:26.9023331",
    "isDeleted": false
  },
  {
    "id": "96b33954-3e6c-4540-a657-0486a58972e1",
    "branchNumber": 2,
    "supplierNumber": 0,
    "shopNumber": 0,
    "categoryNumber": 3003,
    "active": false,
    "date": "2004-03-31T00:00:00",
    "stocktakingDate": "2004-04-03T00:00:00",
    "type": 0,
    "lastChange": "2019-10-22T22:51:26.9023331",
    "isDeleted": false
  },
  {
    "id": "79a7e807-cc4d-4d48-abcf-04bd72184155",
    "branchNumber": 1,
    "supplierNumber": 0,
    "shopNumber": 0,
    "categoryNumber": 3301,
    "active": false,
    "date": "2004-03-31T00:00:00",
    "stocktakingDate": "2004-04-13T00:00:00",
    "type": 0,
    "lastChange": "2019-10-22T22:51:26.9023331",
    "isDeleted": false
  },
  {
    "id": "16342d2b-0da6-4dd5-873d-04bdd2fadfea",
    "branchNumber": 1,
    "supplierNumber": 0,
    "shopNumber": 0,
    "categoryNumber": 3901,
    "active": false,
    "date": "2004-03-31T00:00:00",
    "stocktakingDate": "2004-04-13T00:00:00",
    "type": 0,
    "lastChange": "2019-10-22T22:51:26.9023331",
    "isDeleted": false
  },
  {
    "id": "1dd74e7f-adf3-478d-935a-04c9ec8b1b19",
    "branchNumber": 2,
    "supplierNumber": 0,
    "shopNumber": 0,
    "categoryNumber": 5903,
    "active": false,
    "date": "2004-03-31T00:00:00",
    "stocktakingDate": "2004-04-03T00:00:00",
    "type": 0,
    "lastChange": "2019-10-22T22:51:26.9023331",
    "isDeleted": false
  },
  {
    "id": "73dd4c4c-c6c1-4ebd-94a6-050ddef6c02c",
    "branchNumber": 1,
    "supplierNumber": 0,
    "shopNumber": 0,
    "categoryNumber": 1797,
    "active": false,
    "date": "2004-03-31T00:00:00",
    "stocktakingDate": "2004-04-13T00:00:00",
    "type": 0,
    "lastChange": "2019-10-22T22:51:26.9023331",
    "isDeleted": false
  },
  {
    "id": "c92ca04a-36b4-47a8-87ac-0515ed90638b",
    "branchNumber": 1,
    "supplierNumber": 0,
    "shopNumber": 0,
    "categoryNumber": 7299,
    "active": false,
    "date": "2004-03-31T00:00:00",
    "stocktakingDate": "2004-04-13T00:00:00",
    "type": 0,
    "lastChange": "2019-10-22T22:51:26.9023331",
    "isDeleted": false
  },
  {
    "id": "441747d3-36d3-4068-a472-0579a64b7c11",
    "branchNumber": 1,
    "supplierNumber": 0,
    "shopNumber": 0,
    "categoryNumber": 3197,
    "active": false,
    "date": "2004-03-31T00:00:00",
    "stocktakingDate": "2004-04-13T00:00:00",
    "type": 0,
    "lastChange": "2019-10-22T22:51:26.9023331",